<?xml version="1.0" encoding="UTF-8"?>
<!DOCTYPE report>
<report xmlns:xsi="http://www.w3.org/2001/XMLSchema-instance" xsi:noNamespaceSchemaLocation="ReportSchema.xsd">
	<name>report1</name>
	<datasource>postgres</datasource>
	<sql>
		select now()
	</sql>
	<cron>00 31 12 ? * MON,TUE,WED,THU,FRI</cron>
	<description>Report estrazione data</description>
	<recipient>david.bertini@gmail.com</recipient>
	<cclist>david.bertini@gmail.com</cclist>
	<ccnlist>david.bertini@gmail.com</ccnlist>
	<export>EXCEL</export>
	<template>template_001</template>
</report>